{
  "version": 1,
  "nodes": [
    {
      "id": 1,
      "position": {
        "x": 0,
        "y": 7
      },
      "role": "support",
      "supportType": "fixed"
    },
    {
      "id": 2,
      "position": {
        "x": 10,
        "y": 7
      },
      "role": "deck",
      "supportType": "none"
    },
    {
      "id": 3,
      "position": {
        "x": 20,
        "y": 7
      },
      "role": "deck",
      "supportType": "none"
    },
    {
      "id": 4,
      "position": {
        "x": 30,
        "y": 7
      },
      "role": "deck",
      "supportType": "none"
    },
    {
      "id": 5,
      "position": {
        "x": 40,
        "y": 7
      },
      "role": "support",
      "supportType": "fixed"
    },
    {
      "id": 6,
      "position": {
        "x": 5,
        "y": 15
      },
      "role": "joint",
      "supportType": "none"
    },
    {
      "id": 7,
      "position": {
        "x": 15,
        "y": 15
      },
      "role": "joint",
      "supportType": "none"
    },
    {
      "id": 8,
      "position": {
        "x": 25,
        "y": 15
      },
      "role": "joint",
      "supportType": "none"
    },
    {
      "id": 9,
      "position": {
        "x": 35,
        "y": 15
      },
      "role": "joint",
      "supportType": "none"
    }
  ],
  "members": [
    {
      "id": 1,
      "a": 1,
      "b": 2,
      "role": "chord",
      "memberClass": "lower-chord",
      "capacityClass": 3
    },
    {
      "id": 2,
      "a": 2,
      "b": 3,
      "role": "chord",
      "memberClass": "lower-chord",
      "capacityClass": 3
    },
    {
      "id": 3,
      "a": 3,
      "b": 4,
      "role": "chord",
      "memberClass": "lower-chord",
      "capacityClass": 3
    },
    {
      "id": 4,
      "a": 4,
      "b": 5,
      "role": "chord",
      "memberClass": "lower-chord",
      "capacityClass": 3
    },
    {
      "id": 5,
      "a": 6,
      "b": 7,
      "role": "chord",
      "memberClass": "upper-chord",
      "capacityClass": 3
    },
    {
      "id": 6,
      "a": 7,
      "b": 8,
      "role": "chord",
      "memberClass": "upper-chord",
      "capacityClass": 3
    },
    {
      "id": 7,
      "a": 8,
      "b": 9,
      "role": "chord",
      "memberClass": "upper-chord",
      "capacityClass": 3
    },
    {
      "id": 8,
      "a": 1,
      "b": 6,
      "role": "diagonal",
      "memberClass": "diagonal",
      "capacityClass": 3
    },
    {
      "id": 9,
      "a": 6,
      "b": 2,
      "role": "diagonal",
      "memberClass": "diagonal",
      "capacityClass": 3
    },
    {
      "id": 10,
      "a": 2,
      "b": 7,
      "role": "diagonal",
      "memberClass": "diagonal",
      "capacityClass": 3
    },
    {
      "id": 11,
      "a": 7,
      "b": 3,
      "role": "diagonal",
      "memberClass": "diagonal",
      "capacityClass": 3
    },
    {
      "id": 12,
      "a": 3,
      "b": 8,
      "role": "diagonal",
      "memberClass": "diagonal",
      "capacityClass": 3
    },
    {
      "id": 13,
      "a": 8,
      "b": 4,
      "role": "diagonal",
      "memberClass": "diagonal",
      "capacityClass": 3
    },
    {
      "id": 14,
      "a": 4,
      "b": 9,
      "role": "diagonal",
      "memberClass": "diagonal",
      "capacityClass": 3
    },
    {
      "id": 15,
      "a": 9,
      "b": 5,
      "role": "diagonal",
      "memberClass": "diagonal",
      "capacityClass": 3
    }
  ],
  "cables": [],
  "metadata": {
    "family": "warren",
    "span": 40,
    "designRevision": 1
  }
}
