{
  "version": 1,
  "nodes": [
    {
      "id": 1,
      "position": {
        "x": 0,
        "y": 8
      },
      "role": "support",
      "supportType": "fixed"
    },
    {
      "id": 2,
      "position": {
        "x": 8,
        "y": 8
      },
      "role": "deck",
      "supportType": "none"
    },
    {
      "id": 3,
      "position": {
        "x": 16,
        "y": 8
      },
      "role": "deck",
      "supportType": "none"
    },
    {
      "id": 4,
      "position": {
        "x": 24,
        "y": 8
      },
      "role": "deck",
      "supportType": "none"
    },
    {
      "id": 5,
      "position": {
        "x": 32,
        "y": 8
      },
      "role": "deck",
      "supportType": "none"
    },
    {
      "id": 6,
      "position": {
        "x": 40,
        "y": 8
      },
      "role": "support",
      "supportType": "fixed"
    },
    {
      "id": 7,
      "position": {
        "x": 0,
        "y": 3
      },
      "role": "anchor",
      "supportType": "terrain"
    },
    {
      "id": 8,
      "position": {
        "x": 5,
        "y": 8
      },
      "role": "joint",
      "supportType": "none"
    },
    {
      "id": 9,
      "position": {
        "x": 10,
        "y": 12
      },
      "role": "joint",
      "supportType": "none"
    },
    {
      "id": 10,
      "position": {
        "x": 15,
        "y": 15
      },
      "role": "joint",
      "supportType": "none"
    },
    {
      "id": 11,
      "position": {
        "x": 20,
        "y": 16
      },
      "role": "joint",
      "supportType": "none"
    },
    {
      "id": 12,
      "position": {
        "x": 25,
        "y": 15
      },
      "role": "joint",
      "supportType": "none"
    },
    {
      "id": 13,
      "position": {
        "x": 30,
        "y": 12
      },
      "role": "joint",
      "supportType": "none"
    },
    {
      "id": 14,
      "position": {
        "x": 35,
        "y": 8
      },
      "role": "joint",
      "supportType": "none"
    },
    {
      "id": 15,
      "position": {
        "x": 40,
        "y": 3
      },
      "role": "anchor",
      "supportType": "terrain"
    }
  ],
  "members": [
    {
      "id": 1,
      "a": 1,
      "b": 2,
      "role": "deck",
      "memberClass": "deck",
      "capacityClass": 3
    },
    {
      "id": 2,
      "a": 2,
      "b": 3,
      "role": "deck",
      "memberClass": "deck",
      "capacityClass": 3
    },
    {
      "id": 3,
      "a": 3,
      "b": 4,
      "role": "deck",
      "memberClass": "deck",
      "capacityClass": 3
    },
    {
      "id": 4,
      "a": 4,
      "b": 5,
      "role": "deck",
      "memberClass": "deck",
      "capacityClass": 3
    },
    {
      "id": 5,
      "a": 5,
      "b": 6,
      "role": "deck",
      "memberClass": "deck",
      "capacityClass": 3
    },
    {
      "id": 6,
      "a": 7,
      "b": 8,
      "role": "arch",
      "memberClass": "arch",
      "capacityClass": 3
    },
    {
      "id": 7,
      "a": 8,
      "b": 9,
      "role": "arch",
      "memberClass": "arch",
      "capacityClass": 3
    },
    {
      "id": 8,
      "a": 9,
      "b": 10,
      "role": "arch",
      "memberClass": "arch",
      "capacityClass": 3
    },
    {
      "id": 9,
      "a": 10,
      "b": 11,
      "role": "arch",
      "memberClass": "arch",
      "capacityClass": 3
    },
    {
      "id": 10,
      "a": 11,
      "b": 12,
      "role": "arch",
      "memberClass": "arch",
      "capacityClass": 3
    },
    {
      "id": 11,
      "a": 12,
      "b": 13,
      "role": "arch",
      "memberClass": "arch",
      "capacityClass": 3
    },
    {
      "id": 12,
      "a": 13,
      "b": 14,
      "role": "arch",
      "memberClass": "arch",
      "capacityClass": 3
    },
    {
      "id": 13,
      "a": 14,
      "b": 15,
      "role": "arch",
      "memberClass": "arch",
      "capacityClass": 3
    },
    {
      "id": 14,
      "a": 8,
      "b": 1,
      "role": "vertical",
      "memberClass": "vertical",
      "capacityClass": 3
    },
    {
      "id": 15,
      "a": 9,
      "b": 2,
      "role": "vertical",
      "memberClass": "vertical",
      "capacityClass": 3
    },
    {
      "id": 16,
      "a": 10,
      "b": 3,
      "role": "vertical",
      "memberClass": "vertical",
      "capacityClass": 3
    },
    {
      "id": 17,
      "a": 12,
      "b": 4,
      "role": "vertical",
      "memberClass": "vertical",
      "capacityClass": 3
    },
    {
      "id": 18,
      "a": 13,
      "b": 5,
      "role": "vertical",
      "memberClass": "vertical",
      "capacityClass": 3
    },
    {
      "id": 19,
      "a": 14,
      "b": 6,
      "role": "vertical",
      "memberClass": "vertical",
      "capacityClass": 3
    }
  ],
  "cables": [],
  "metadata": {
    "family": "arch",
    "span": 40,
    "designRevision": 1
  }
}
